{
  "$schema": "http://json-schema.org/draft-07/schema#",
  "title": "UniClaw Scenario Library Entry (v2)",
  "description": "仿真场景库条目：元数据 + 期望值快照 + 可选 golden 认证 + Agent realization 拆分标注 + 安全评审。kind=none 的专有载体可保留未认证 expectations 作为描述性记录，但不得携带 certification。独立基础设施，不依附于任何文档。SIM-002 S5/S6/S8 重建：v1 曾为非法 JSON 且零消费；v2 起由 tools/scenario-coverage.py 以 jsonschema（draft-07）真校验，违规 exit 1。",
  "type": "object",
  "additionalProperties": false,
  "required": [
    "id",
    "name",
    "source",
    "purpose",
    "capability",
    "components",
    "status",
    "version",
    "agentDecisionRealization",
    "goalEvaluationRealization",
    "expectations",
    "execution",
    "security"
  ],
  "properties": {
    "id": {
      "type": "string",
      "pattern": "^SCN-[A-Z0-9][A-Z0-9-]*$",
      "description": "唯一标识，如 SCN-WIFI-001"
    },
    "name": {
      "type": "string",
      "description": "人读名称"
    },
    "source": {
      "type": "string",
      "enum": ["recorded", "synthetic", "derived-from-doc", "bug-repro", "component-test"],
      "description": "场景来源类型（S6：generated 已更名 synthetic——参数化合成，非录制）"
    },
    "srRef": {
      "type": ["string", "null"],
      "description": "可选：来源标注 ARCH-DOC-017 的 SR-xxx"
    },
    "templateRef": {
      "type": ["string", "null"],
      "description": "可选（D5）：生成式场景的模板引用（SCN-xxx——ScenarioBuilder.FromTemplate 的来源条目）"
    },
    "purpose": {
      "type": "string",
      "description": "测什么、为什么存在"
    },
    "capability": {
      "type": "string",
      "description": "测的产品能力域（如 effect-verification / identity-continuity）"
    },
    "components": {
      "type": "array",
      "items": { "type": "string" },
      "description": "涉及的组件（如 kernel / assurance / effect-boundary / world-model）"
    },
    "status": {
      "type": "string",
      "enum": ["passing", "failing", "pending-env", "not-implemented"],
      "description": "声明的测试状态；G3 真值链：必须与 TRX 派生值一致，否则覆盖率工具 exit 1"
    },
    "version": {
      "type": "integer",
      "minimum": 1,
      "description": "行为变更时 bump（期望迁移搭乘致因 change，见 certification.certifiedByChange）"
    },
    "testScope": {
      "type": "string",
      "enum": [
        "component"
      ],
      "description": "SIM-015 C7：仅明确无 Agent 参与的组件隔离载体可声明 component；缺省保留既有装配约束。"
    },
    "agentDecisionRealization": {
      "type": "string",
      "enum": ["real", "double", "not-applicable"],
      "description": "SIM-015：仅显式组件隔离允许 not-applicable；C7 v0.2 决策面（ConsultAgent seam 实现）；与实际构成一致性由 ScenarioRealizationAnnotationTests 执法"
    },
    "goalEvaluationRealization": {
      "type": "string",
      "enum": ["real", "double", "not-applicable"],
      "description": "C7 v0.2 + SIM-007：评估面（PrimaryGoal→GoalEvaluation）；kind=none 且载体不构造评估时使用 not-applicable；与实际构成一致性由 ScenarioRealizationAnnotationTests 执法"
    },
    "deviation": {
      "type": "array",
      "items": { "type": "string" },
      "description": "C1/R1：double 与协议基线的已知偏差清单（缺席 = 无已知偏差）"
    },
    "expectations": {
      "type": "object",
      "additionalProperties": false,
      "required": ["status", "classification", "effects", "agentConsultations", "unconsumedStimuli", "goalSatisfaction"],
      "description": "期望值快照（golden；经 certification 块钉扎——G2）",
      "properties": {
        "status": { "type": "string", "description": "期望 RunDriveStatus" },
        "classification": { "type": ["string", "null"], "description": "期望 TerminalClassification" },
        "effects": { "type": "integer", "description": "期望效果投递数" },
        "agentConsultations": { "type": "integer", "description": "期望咨询次数" },
        "unconsumedStimuli": { "type": "integer", "description": "期望未消费 stimulus 数" },
        "goalSatisfaction": { "type": ["string", "null"], "description": "期望 GoalSatisfaction" }
      }
    },
    "execution": {
      "type": "object",
      "additionalProperties": false,
      "required": ["kind"],
      "description": "SIM-003 G3：executable carrier 绑定（经 certification.executionDigest 钉扎——kind=golden-bundle 的期望必须由 certified JSON 投影；kind=none 显式声明不在本投影保证内）",
      "properties": {
        "kind": {
          "type": "string",
          "enum": ["golden-bundle", "none"],
          "description": "golden-bundle = ScenarioRunner 经 MinimalScenarioBundle 承载；none = 无 bundle carrier（如 PERC 自有 harness），期望绑定保证不适用"
        },
        "carrier": {
          "type": ["string", "null"],
          "description": "kind=golden-bundle 必填：GoldenScenarioBundles carrier 注册键（如 wifi-off-to-on）；kind=none 必须缺省或 null"
        },
        "options": {
          "type": "object",
          "additionalProperties": false,
          "description": "RunOptions 投影（可选）",
          "properties": {
            "duplicateActivation": { "type": "boolean", "description": "S3 重复激活探针" },
            "phased": { "type": "boolean", "description": "D21 phased 两阶段驱动" }
          }
        }
      },
      "allOf": [
        {
          "if": { "properties": { "kind": { "const": "golden-bundle" } } },
          "then": { "required": ["carrier"] }
        },
        {
          "if": { "properties": { "kind": { "const": "none" } }, "required": ["kind"] },
          "then": { "not": { "required": ["carrier"] } }
        }
      ]
    },
    "certification": {
      "type": "object",
      "additionalProperties": false,
      "required": ["schemaVersion", "expectationsDigest", "executionDigest", "runtimeSourceHash", "certifiedByChange", "certifiedAt"],
      "description": "G2 golden 认证 v2（唯一写入口 tools/scenario_certify.py --change <致因change>）；expectationsDigest 钉「测什么结果」，executionDigest 钉「用什么 carrier 测」",
      "properties": {
        "schemaVersion": { "type": "integer", "const": 2 },
        "expectationsDigest": {
          "type": "string",
          "pattern": "^[0-9a-f]{64}$",
          "description": "期望值 canonical rendering SHA-256（cert-exp-v1）"
        },
        "executionDigest": {
          "type": "string",
          "pattern": "^[0-9a-f]{64}$",
          "description": "执行绑定 canonical rendering SHA-256（cert-exec-v1：kind/carrier/options）"
        },
        "runtimeSourceHash": {
          "type": "string",
          "pattern": "^[0-9a-f]{64}$",
          "description": "认证时 Kernel+Agent 源码状态哈希（cert-src-v1）"
        },
        "certifiedByChange": {
          "type": "string",
          "minLength": 1,
          "description": "致因 change 引用（C8 搭乘协议）"
        },
        "certifiedAt": {
          "type": "string",
          "pattern": "^[0-9]{4}-[0-9]{2}-[0-9]{2}$",
          "description": "认证日期"
        }
      }
    },
    "security": {
      "type": "object",
      "additionalProperties": false,
      "required": ["sensitiveReview"],
      "description": "C9 场景数据安全；库内条目必须 cleared（fail-closed，工具执法）",
      "properties": {
        "sensitiveReview": {
          "type": "string",
          "enum": ["cleared", "pending"],
          "description": "敏感内容评审状态；pending 不得留在库内"
        },
        "reviewNote": {
          "type": "string",
          "description": "可选：评审依据（如资产来源、脱敏方式）"
        }
      }
    }
  },
  "allOf": [
    {
      "if": {
        "properties": {
          "execution": { "properties": { "kind": { "const": "golden-bundle" } } }
        }
      },
      "then": { "required": ["certification"] }
    },
    {
      "if": {
        "properties": {
          "execution": { "properties": { "kind": { "const": "none" } } }
        }
      },
      "then": { "not": { "required": ["certification"] } }
    },
    {
      "if": {
        "required": [
          "testScope"
        ],
        "properties": {
          "testScope": {
            "const": "component"
          }
        }
      },
      "then": {
        "properties": {
          "source": {
            "const": "component-test"
          },
          "components": {
            "minItems": 1,
            "not": {
              "contains": {
                "enum": [
                  "agent",
                  "uni-agent"
                ]
              }
            }
          },
          "execution": {
            "properties": {
              "kind": {
                "const": "none"
              }
            }
          },
          "agentDecisionRealization": {
            "const": "not-applicable"
          },
          "goalEvaluationRealization": {
            "const": "not-applicable"
          },
          "expectations": {
            "properties": {
              "status": {
                "const": "not-applicable"
              },
              "agentConsultations": {
                "const": 0
              },
              "classification": {
                "type": "null"
              },
              "goalSatisfaction": {
                "type": "null"
              }
            }
          }
        }
      }
    },
    {
      "if": {
        "required": [
          "agentDecisionRealization"
        ],
        "properties": {
          "agentDecisionRealization": {
            "const": "not-applicable"
          }
        }
      },
      "then": {
        "required": [
          "testScope"
        ],
        "properties": {
          "testScope": {
            "const": "component"
          }
        }
      }
    }
  ]
}
