{
  "id": "SCN-REPLAY-004",
  "name": "录制导航：后观察缺失、错误与恢复",
  "source": "recorded",
  "purpose": "原 XML 经 Host 导入校验为冻结 typed 输入；Simulation 回放丢失 post 后同 Run 恢复，独立期望检出未变化导航",
  "capability": "recorded-navigation-recovery",
  "components": [
    "perception",
    "evidence-ledger",
    "world-model",
    "control",
    "effect-boundary",
    "assurance",
    "runtime"
  ],
  "status": "passing",
  "version": 1,
  "agentDecisionRealization": "double",
  "goalEvaluationRealization": "not-applicable",
  "expectations": {
    "status": "TerminalNotProven",
    "classification": null,
    "effects": 1,
    "agentConsultations": 2,
    "unconsumedStimuli": 0,
    "goalSatisfaction": null
  },
  "execution": {
    "kind": "none"
  },
  "security": {
    "sensitiveReview": "cleared",
    "reviewNote": "既有fastscreen-v1本地录制XML；输入hash与详细期望见recorded-operations.json，无新采集"
  }
}
