{
  "id": "SCN-WIFI-003",
  "name": "Duplicate activation → single Primary Run",
  "source": "recorded",
  "srRef": "SR-047",
  "purpose": "Idempotent activation: 3 attempts all accepted, same RunId, zero extra effects",
  "capability": "activation-idempotency",
  "components": [
    "kernel",
    "run-model"
  ],
  "status": "passing",
  "version": 2,
  "agentDecisionRealization": "double",
  "goalEvaluationRealization": "real",
  "expectations": {
    "status": "Completed",
    "classification": "Completion",
    "effects": 1,
    "agentConsultations": 2,
    "unconsumedStimuli": 0,
    "goalSatisfaction": "Satisfied"
  },
  "execution": {
    "kind": "golden-bundle",
    "carrier": "wifi-off-to-on",
    "options": {
      "duplicateActivation": true
    }
  },
  "certification": {
    "schemaVersion": 2,
    "expectationsDigest": "7de541f28738e307e7f2a65f303e508ef1c461b0240e3019c3664235782ebdc2",
    "executionDigest": "f6f9802bd5ce7d7b59222c82754e252a8ec4547ff9cb76587943397366fca864",
    "runtimeSourceHash": "e9aaaf399d12ce23201ff0624b7316e1533f09e35c5615465598a9ab40aa1919",
    "certifiedByChange": "LIFECYCLE-CLOSURE-001",
    "certifiedAt": "2026-10-14"
  },
  "security": {
    "sensitiveReview": "cleared"
  }
}
