{
  "id": "SCN-WIFI-001",
  "name": "WiFi switch off→on (happy path)",
  "source": "recorded",
  "srRef": "SR-001",
  "purpose": "Verify complete closed loop: observe→identify→decide→tap→verify→Completion",
  "capability": "effect-verification",
  "components": [
    "kernel",
    "assurance",
    "effect-boundary",
    "world-model"
  ],
  "status": "passing",
  "version": 1,
  "agentDecisionRealization": "double",
  "goalEvaluationRealization": "real",
  "expectations": {
    "status": "Completed",
    "classification": "Completion",
    "effects": 1,
    "agentConsultations": 2,
    "unconsumedStimuli": 0,
    "goalSatisfaction": "Satisfied"
  },
  "execution": {
    "kind": "golden-bundle",
    "carrier": "wifi-off-to-on"
  },
  "certification": {
    "schemaVersion": 2,
    "expectationsDigest": "7de541f28738e307e7f2a65f303e508ef1c461b0240e3019c3664235782ebdc2",
    "executionDigest": "981ff6dac9b804f8e5e1208f622ef50567d89aba289df01f6410e1d635cbb8ae",
    "runtimeSourceHash": "e893fe8a1914a1bf67069233777cdb95bf215073b88823d45fda481f5ebcd8de",
    "certifiedByChange": "AGT-019",
    "certifiedAt": "2026-10-16"
  },
  "security": {
    "sensitiveReview": "cleared"
  }
}
