{
  "id": "SCN-PERC-002",
  "name": "Fast misjudge → slow corrects → completion",
  "source": "synthetic",
  "srRef": "SR-009",
  "purpose": "Fast detection wrong, slow correction arrives → belief revision → verified completion",
  "capability": "evidence-revision",
  "components": [
    "kernel",
    "world-model",
    "assurance"
  ],
  "status": "passing",
  "version": 1,
  "agentDecisionRealization": "double",
  "goalEvaluationRealization": "real",
  "expectations": {
    "status": "Completed",
    "classification": "Completion",
    "effects": 1,
    "agentConsultations": 2,
    "unconsumedStimuli": 0,
    "goalSatisfaction": "Satisfied"
  },
  "execution": {
    "kind": "none"
  },
  "certification": {
    "schemaVersion": 2,
    "expectationsDigest": "7de541f28738e307e7f2a65f303e508ef1c461b0240e3019c3664235782ebdc2",
    "executionDigest": "681e3afcd6d1fd935c911386cf8d963361d8d875227b410c08df10f1c0b18fcd",
    "runtimeSourceHash": "d5cd2f3fe232249be3878685342cbbbdf0045189c0ca084203010b5e187b2ff6",
    "certifiedByChange": "PER-015",
    "certifiedAt": "2026-09-27"
  },
  "security": {
    "sensitiveReview": "cleared"
  }
}
