{
  "id": "SCN-WIFI-005",
  "name": "Cancel during wait → SafeStop",
  "source": "recorded",
  "srRef": "SR-067",
  "purpose": "Cancel signal during post-action wait → safe stop, zero revival, late stimulus unconsumed",
  "capability": "safe-stop",
  "components": [
    "kernel",
    "assurance",
    "effect-boundary"
  ],
  "status": "passing",
  "version": 2,
  "agentDecisionRealization": "double",
  "goalEvaluationRealization": "real",
  "expectations": {
    "status": "Completed",
    "classification": "SafeStop",
    "effects": 1,
    "agentConsultations": 1,
    "unconsumedStimuli": 1,
    "goalSatisfaction": "Unsatisfied"
  },
  "execution": {
    "kind": "golden-bundle",
    "carrier": "wifi-cancel-late",
    "options": {
      "phased": true
    }
  },
  "certification": {
    "schemaVersion": 2,
    "expectationsDigest": "7f4b1806e36b413ca49b16b4cdb7e702a181fb74ceb5da084945e2b252de70d6",
    "executionDigest": "b823e11cbbeba98d2b21f47c496283b691f6ebf8bef86b52c9651eb2b0b14db2",
    "runtimeSourceHash": "422010cf5733653f7c4d6e89e24df644df8cf179a694e78e92c2a97cf562b89c",
    "certifiedByChange": "AGT-019",
    "certifiedAt": "2026-10-15"
  },
  "security": {
    "sensitiveReview": "cleared"
  }
}
